{
  "artifact_family": "terraform.proxmox",
  "capabilities": [],
  "ir_version": "1.0",
  "obsolete_candidates": [],
  "planned_outputs": [
    {
      "path": "/home/dmpr/workspaces/projects/home-lab/generated/home-lab/terraform/proxmox/bridges.tf",
      "reason": "base-family",
      "renderer": "jinja2",
      "required": true,
      "template": "terraform/bridges.tf.j2"
    },
    {
      "path": "/home/dmpr/workspaces/projects/home-lab/generated/home-lab/terraform/proxmox/lxc.tf",
      "reason": "base-family",
      "renderer": "jinja2",
      "required": true,
      "template": "terraform/lxc.tf.j2"
    },
    {
      "path": "/home/dmpr/workspaces/projects/home-lab/generated/home-lab/terraform/proxmox/outputs.tf",
      "reason": "base-family",
      "renderer": "jinja2",
      "required": true,
      "template": "terraform/outputs.tf.j2"
    },
    {
      "path": "/home/dmpr/workspaces/projects/home-lab/generated/home-lab/terraform/proxmox/provider.tf",
      "reason": "base-family",
      "renderer": "jinja2",
      "required": true,
      "template": "terraform/provider.tf.j2"
    },
    {
      "path": "/home/dmpr/workspaces/projects/home-lab/generated/home-lab/terraform/proxmox/terraform.tfvars.example",
      "reason": "base-family",
      "renderer": "jinja2",
      "required": true,
      "template": "terraform/terraform.tfvars.example.j2"
    },
    {
      "path": "/home/dmpr/workspaces/projects/home-lab/generated/home-lab/terraform/proxmox/variables.tf",
      "reason": "base-family",
      "renderer": "jinja2",
      "required": true,
      "template": "terraform/variables.tf.j2"
    },
    {
      "path": "/home/dmpr/workspaces/projects/home-lab/generated/home-lab/terraform/proxmox/versions.tf",
      "reason": "base-family",
      "renderer": "jinja2",
      "required": true,
      "template": "terraform/versions.tf.j2"
    },
    {
      "path": "/home/dmpr/workspaces/projects/home-lab/generated/home-lab/terraform/proxmox/vms.tf",
      "reason": "base-family",
      "renderer": "jinja2",
      "required": true,
      "template": "terraform/vms.tf.j2"
    }
  ],
  "plugin_id": "object.proxmox.generator.terraform",
  "projection_version": "1.0",
  "schema_version": "1.0",
  "validation_profiles": [
    "production"
  ]
}
