{
  "artifact_family": "wireguard.configs",
  "capabilities": [],
  "ir_version": "1.0",
  "obsolete_candidates": [
    {
      "action": "warn",
      "ownership_method": "previous_plan_match",
      "ownership_proven": true,
      "path": "generated/home-lab/wireguard/mikrotik-wg0.rsc",
      "reason": "obsolete-shadowed"
    },
    {
      "action": "warn",
      "ownership_method": "previous_plan_match",
      "ownership_proven": true,
      "path": "generated/home-lab/wireguard/vps-wg0.conf",
      "reason": "obsolete-shadowed"
    }
  ],
  "planned_outputs": [
    {
      "path": "generated/home-lab/wireguard/README.md",
      "reason": "base-family",
      "renderer": "jinja2",
      "required": true
    }
  ],
  "plugin_id": "base.generator.wireguard",
  "projection_version": "1.0",
  "schema_version": "1.0",
  "validation_profiles": [
    "dev"
  ]
}
