{
  "artifact_family": "ansible.inventory",
  "capabilities": [],
  "ir_version": "1.0",
  "obsolete_candidates": [],
  "planned_outputs": [
    {
      "path": "/home/dmpr/workspaces/projects/home-lab/generated/home-lab/ansible/inventory/production/hosts.yml",
      "reason": "base-family",
      "renderer": "structured",
      "required": true
    },
    {
      "path": "/home/dmpr/workspaces/projects/home-lab/generated/home-lab/ansible/inventory/production/group_vars/all.yml",
      "reason": "base-family",
      "renderer": "structured",
      "required": true
    },
    {
      "path": "/home/dmpr/workspaces/projects/home-lab/generated/home-lab/ansible/inventory/production/host_vars/lxc-docker.yml",
      "reason": "base-family",
      "renderer": "structured",
      "required": true
    },
    {
      "path": "/home/dmpr/workspaces/projects/home-lab/generated/home-lab/ansible/inventory/production/host_vars/lxc-gitea.yml",
      "reason": "base-family",
      "renderer": "structured",
      "required": true
    },
    {
      "path": "/home/dmpr/workspaces/projects/home-lab/generated/home-lab/ansible/inventory/production/host_vars/lxc-grafana.yml",
      "reason": "base-family",
      "renderer": "structured",
      "required": true
    },
    {
      "path": "/home/dmpr/workspaces/projects/home-lab/generated/home-lab/ansible/inventory/production/host_vars/lxc-homeassistant.yml",
      "reason": "base-family",
      "renderer": "structured",
      "required": true
    },
    {
      "path": "/home/dmpr/workspaces/projects/home-lab/generated/home-lab/ansible/inventory/production/host_vars/lxc-nextcloud.yml",
      "reason": "base-family",
      "renderer": "structured",
      "required": true
    },
    {
      "path": "/home/dmpr/workspaces/projects/home-lab/generated/home-lab/ansible/inventory/production/host_vars/lxc-nginx-proxy.yml",
      "reason": "base-family",
      "renderer": "structured",
      "required": true
    },
    {
      "path": "/home/dmpr/workspaces/projects/home-lab/generated/home-lab/ansible/inventory/production/host_vars/lxc-postgresql.yml",
      "reason": "base-family",
      "renderer": "structured",
      "required": true
    },
    {
      "path": "/home/dmpr/workspaces/projects/home-lab/generated/home-lab/ansible/inventory/production/host_vars/lxc-prometheus.yml",
      "reason": "base-family",
      "renderer": "structured",
      "required": true
    },
    {
      "path": "/home/dmpr/workspaces/projects/home-lab/generated/home-lab/ansible/inventory/production/host_vars/lxc-redis.yml",
      "reason": "base-family",
      "renderer": "structured",
      "required": true
    },
    {
      "path": "/home/dmpr/workspaces/projects/home-lab/generated/home-lab/ansible/inventory/production/host_vars/rtr-mikrotik-chateau.yml",
      "reason": "base-family",
      "renderer": "structured",
      "required": true
    },
    {
      "path": "/home/dmpr/workspaces/projects/home-lab/generated/home-lab/ansible/inventory/production/host_vars/rtr-slate.yml",
      "reason": "base-family",
      "renderer": "structured",
      "required": true
    },
    {
      "path": "/home/dmpr/workspaces/projects/home-lab/generated/home-lab/ansible/inventory/production/host_vars/srv-gamayun.yml",
      "reason": "base-family",
      "renderer": "structured",
      "required": true
    },
    {
      "path": "/home/dmpr/workspaces/projects/home-lab/generated/home-lab/ansible/inventory/production/host_vars/srv-orangepi5.yml",
      "reason": "base-family",
      "renderer": "structured",
      "required": true
    },
    {
      "path": "/home/dmpr/workspaces/projects/home-lab/generated/home-lab/ansible/inventory/production/host_vars/vps-hetzner-nuremberg.yml",
      "reason": "base-family",
      "renderer": "structured",
      "required": true
    },
    {
      "path": "/home/dmpr/workspaces/projects/home-lab/generated/home-lab/ansible/inventory/production/host_vars/vps-oracle-frankfurt.yml",
      "reason": "base-family",
      "renderer": "structured",
      "required": true
    }
  ],
  "plugin_id": "base.generator.ansible_inventory",
  "projection_version": "1.0",
  "schema_version": "1.0",
  "validation_profiles": [
    "production"
  ]
}
